{
  "schemaVersion": "1.0",
  "resolverVersion": "fixture-identity-v1",
  "requestId": "20000000-0000-4000-8000-000000000001",
  "data": {
    "ingredientId": "10000000-0000-4000-8000-000000000101",
    "identityKey": "smartcart-food:parmesan-cheese",
    "canonicalName": "Parmesan cheese",
    "modifiers": {
      "form": "grated",
      "variety": null,
      "criticalAttributes": [],
      "unclassified": []
    },
    "confidence": "strong",
    "safeForRetailerQuery": true,
    "retailerQuery": "Parmesan cheese",
    "evidence": [
      {
        "evidenceId": "identity-parmesan-1",
        "kind": "curatedData",
        "sourceName": "Synthetic golden identity catalog",
        "sourceVersion": "fixture-v1",
        "sourceRecordId": "smartcart-food:parmesan-cheese",
        "description": "Deterministic test identity; not a production catalog record."
      }
    ],
    "issues": []
  }
}
